{
  "state_version": "1.0",
  "episode_id": "E005",
  "current_stage": "RENDER_CONTRACT_READY",
  "voice_gate": {
    "status": "PASS",
    "approved_scope": "L1_L7_FULL_PACKAGE",
    "approval_kind": "USER_EXPLICIT",
    "evidence": "episodes/E005/README.md — L8 user explicit approval recorded 2026-09-05"
  },
  "decisions": [],
  "frame_qc": {}
}
